{
  "$schema": "http://json-schema.org/draft-07/schema",
  "$id": "https://docs.commercetools.com/merchant-center-customizations/custom-application.schema.json",
  "title": "JSON schema for Custom Application configuration files",
  "type": "object",
  "definitions": {
    "cspDirective": {
      "type": "array",
      "items": {
        "type": "string"
      },
      "uniqueItems": true
    }
  },
  "properties": {
    "name": {
      "description": "See https://docs.commercetools.com/merchant-center-customizations/tooling-and-configuration/custom-application-config#name",
      "type": "string"
    },
    "description": {
      "description": "See https://docs.commercetools.com/merchant-center-customizations/tooling-and-configuration/custom-application-config#description",
      "type": "string"
    },
    "entryPointUriPath": {
      "description": "See https://docs.commercetools.com/merchant-center-customizations/tooling-and-configuration/custom-application-config#entrypointuripath",
      "type": "string"
    },
    "cloudIdentifier": {
      "description": "See https://docs.commercetools.com/merchant-center-customizations/tooling-and-configuration/custom-application-config#cloudidentifier",
      "type": "string"
    },
    "mcApiUrl": {
      "description": "See https://docs.commercetools.com/merchant-center-customizations/tooling-and-configuration/custom-application-config#mcapiurl",
      "type": "string"
    },
    "oAuthScopes": {
      "description": "See https://docs.commercetools.com/merchant-center-customizations/tooling-and-configuration/custom-application-config#oauthscopes",
      "type": "object",
      "properties": {
        "view": {
          "description": "See https://docs.commercetools.com/merchant-center-customizations/tooling-and-configuration/custom-application-config#oauthscopesview",
          "type": "array",
          "default": [],
          "items": {
            "type": "string",
            "pattern": "view_(.*)"
          },
          "uniqueItems": true
        },
        "manage": {
          "description": "See https://docs.commercetools.com/merchant-center-customizations/tooling-and-configuration/custom-application-config#oauthscopesmanage",
          "type": "array",
          "default": [],
          "items": {
            "type": "string",
            "pattern": "manage_(.*)"
          },
          "uniqueItems": true
        }
      },
      "additionalProperties": false,
      "required": ["view", "manage"]
    },
    "additionalOAuthScopes": {
      "description": "See https://docs.commercetools.com/merchant-center-customizations/tooling-and-configuration/custom-application-config#additionaloauthscopes",
      "type": "array",
      "default": [],
      "uniqueItems": true,
      "items": {
        "type": "object",
        "properties": {
          "name": {
            "description": "See https://docs.commercetools.com/merchant-center-customizations/tooling-and-configuration/custom-application-config#additionaloauthscopesname",
            "type": "string"
          },
          "view": {
            "description": "See https://docs.commercetools.com/merchant-center-customizations/tooling-and-configuration/custom-application-config#additionaloauthscopesview",
            "type": "array",
            "default": [],
            "items": {
              "type": "string",
              "pattern": "view_(.*)"
            },
            "uniqueItems": true
          },
          "manage": {
            "description": "See https://docs.commercetools.com/merchant-center-customizations/tooling-and-configuration/custom-application-config#additionaloauthscopesmanage",
            "type": "array",
            "default": [],
            "items": {
              "type": "string",
              "pattern": "manage_(.*)"
            },
            "uniqueItems": true
          }
        },
        "additionalProperties": false,
        "required": ["name", "view", "manage"]
      }
    },
    "env": {
      "description": "See https://docs.commercetools.com/merchant-center-customizations/tooling-and-configuration/custom-application-config#env",
      "type": "object",
      "properties": {
        "development": {
          "type": "object",
          "properties": {
            "initialProjectKey": {
              "description": "See https://docs.commercetools.com/merchant-center-customizations/tooling-and-configuration/custom-application-config#envdevelopmentinitialprojectkey",
              "type": "string"
            },
            "teamId": {
              "type": "string"
            },
            "mcIdentityLoginModeOverride": {
              "description": "Set to 'legacy' to use legacy login mode for development, sending x-mc-identity-login-mode-override header instead of cookies",
              "type": "string",
              "enum": ["legacy"]
            },
            "menuGroup": {
              "description": "Optional navbar group header used when rendering menuLinks in local development",
              "type": "object",
              "properties": {
                "label": {
                  "type": "string"
                },
                "isNew": {
                  "type": "boolean"
                }
              },
              "additionalProperties": false
            }
          },
          "additionalProperties": false,
          "required": ["initialProjectKey"]
        },
        "production": {
          "type": "object",
          "properties": {
            "applicationId": {
              "description": "See https://docs.commercetools.com/merchant-center-customizations/tooling-and-configuration/custom-application-config#envproductionapplicationid",
              "type": "string"
            },
            "url": {
              "description": "See https://docs.commercetools.com/merchant-center-customizations/tooling-and-configuration/custom-application-config#envproductionurl",
              "type": "string"
            },
            "cdnUrl": {
              "description": "See https://docs.commercetools.com/merchant-center-customizations/tooling-and-configuration/custom-application-config#envproductioncdnurl",
              "type": "string"
            }
          },
          "additionalProperties": false,
          "required": ["applicationId", "url"]
        }
      },
      "additionalProperties": false,
      "required": ["development", "production"]
    },
    "additionalEnv": {
      "description": "See https://docs.commercetools.com/merchant-center-customizations/tooling-and-configuration/custom-application-config#additionalenv",
      "type": "object"
    },
    "headers": {
      "description": "See https://docs.commercetools.com/merchant-center-customizations/tooling-and-configuration/custom-application-config#headers",
      "type": "object",
      "properties": {
        "csp": {
          "description": "See https://docs.commercetools.com/merchant-center-customizations/tooling-and-configuration/custom-application-config#headerscsp",
          "type": "object",
          "properties": {
            "connect-src": {
              "$ref": "#/definitions/cspDirective"
            },
            "font-src": {
              "$ref": "#/definitions/cspDirective"
            },
            "img-src": {
              "$ref": "#/definitions/cspDirective"
            },
            "script-src": {
              "$ref": "#/definitions/cspDirective"
            },
            "style-src": {
              "$ref": "#/definitions/cspDirective"
            },
            "frame-src": {
              "$ref": "#/definitions/cspDirective"
            },
            "media-src": {
              "$ref": "#/definitions/cspDirective"
            }
          },
          "additionalProperties": false,
          "required": ["connect-src"]
        },
        "permissionsPolicies": {
          "description": "See https://docs.commercetools.com/merchant-center-customizations/tooling-and-configuration/custom-application-config#headerspermissionspolicies",
          "type": "object"
        },
        "strictTransportSecurity": {
          "type": "array",
          "items": {
            "enum": ["includeSubDomains", "preload"]
          },
          "uniqueItems": true,
          "deprecated": true
        }
      },
      "additionalProperties": false
    },
    "icon": {
      "description": "See https://docs.commercetools.com/merchant-center-customizations/tooling-and-configuration/custom-application-config#icon",
      "type": "string"
    },
    "mainMenuLink": {
      "description": "See https://docs.commercetools.com/merchant-center-customizations/tooling-and-configuration/custom-application-config#mainmenulink",
      "type": "object",
      "properties": {
        "defaultLabel": {
          "description": "See https://docs.commercetools.com/merchant-center-customizations/tooling-and-configuration/custom-application-config#mainmenulinkdefaultlabel",
          "type": "string"
        },
        "labelAllLocales": {
          "description": "See https://docs.commercetools.com/merchant-center-customizations/tooling-and-configuration/custom-application-config#mainmenulinklabelalllocales",
          "type": "array",
          "default": [],
          "items": {
            "type": "object",
            "properties": {
              "locale": {
                "type": "string",
                "enum": ["en", "de", "es", "fr-FR", "pt-BR"]
              },
              "value": {
                "type": "string"
              }
            },
            "additionalProperties": false,
            "required": ["locale", "value"]
          }
        },
        "permissions": {
          "description": "See https://docs.commercetools.com/merchant-center-customizations/tooling-and-configuration/custom-application-config#mainmenulinkpermissions",
          "type": "array",
          "default": [],
          "items": {
            "type": "string"
          }
        }
      },
      "additionalProperties": true,
      "required": ["defaultLabel", "labelAllLocales", "permissions"]
    },
    "submenuLinks": {
      "description": "See https://docs.commercetools.com/merchant-center-customizations/tooling-and-configuration/custom-application-config#submenulinks",
      "default": [],
      "type": "array",
      "items": {
        "type": "object",
        "properties": {
          "uriPath": {
            "description": "See https://docs.commercetools.com/merchant-center-customizations/tooling-and-configuration/custom-application-config#submenulinksuripath",
            "type": "string"
          },
          "defaultLabel": {
            "description": "See https://docs.commercetools.com/merchant-center-customizations/tooling-and-configuration/custom-application-config#submenulinksdefaultlabel",
            "type": "string"
          },
          "labelAllLocales": {
            "description": "See https://docs.commercetools.com/merchant-center-customizations/tooling-and-configuration/custom-application-config#submenulinkslabelalllocales",
            "type": "array",
            "default": [],
            "items": {
              "type": "object",
              "properties": {
                "locale": {
                  "type": "string",
                  "enum": ["en", "de", "es", "fr-FR", "pt-BR"]
                },
                "value": {
                  "type": "string"
                }
              },
              "additionalProperties": false,
              "required": ["locale", "value"]
            }
          },
          "permissions": {
            "description": "See https://docs.commercetools.com/merchant-center-customizations/tooling-and-configuration/custom-application-config#submenulinkspermissions",
            "type": "array",
            "default": [],
            "items": {
              "type": "string"
            }
          }
        },
        "additionalProperties": true,
        "required": [
          "uriPath",
          "defaultLabel",
          "labelAllLocales",
          "permissions"
        ]
      }
    }
  },
  "additionalProperties": true,
  "required": [
    "name",
    "entryPointUriPath",
    "cloudIdentifier",
    "env",
    "oAuthScopes",
    "icon",
    "mainMenuLink",
    "submenuLinks"
  ]
}
