{
  "name": "avengers-app",
  "entryPointUriPath": "avengers",
  "cloudIdentifier": "gcp-eu",
  "env": {
    "development": {
      "initialProjectKey": "project-key"
    },
    "production": {
      "applicationId": "app-id-123",
      "url": "https://avengers.app"
    }
  },
  "oAuthScopes": {
    "view": ["view_orders", "view_states"],
    "manage": ["manage_orders"]
  },
  "icon": "<svg><path fill=\"#000000\" /></svg>",
  "mainMenuLink": {
    "defaultLabel": "Avengers",
    "labelAllLocales": [],
    "permissions": []
  },
  "submenuLinks": []
}
