{
  "name": "avengers-app",
  "entryPointUriPath": "avengers",
  "cloudIdentifier": "gcp-eu",
  "env": {
    "development": {
      "initialProjectKey": "test"
    },
    "production": {
      "applicationId": "app-id-123",
      "url": "https://my-app.com"
    }
  },
  "oAuthScopes": {
    "view": ["view_products"],
    "manage": []
  },
  "icon": "${path:@commercetools-frontend/assets/application-icons/rocket.svg}",
  "mainMenuLink": {
    "defaultLabel": "Avengers",
    "labelAllLocales": [
      {
        "locale": "en",
        "value": "${intl:en:Menu.Avengers}"
      }
    ],
    "permissions": ["ViewAvengers"]
  },
  "submenuLinks": []
}
